Scenario,Law,Similarity
"I purchased a new laptop online, but it arrived with a broken screen. The seller refuses to replace it or refund my money. What can I do?","The Consumer Protection Act, 2019 - Provides consumer rights and redressal mechanisms for faulty products or services.",1
"The old woman died, and the prosecution alleged that the Appellant caused her death through physical assault, leading to fatal chest injuries.","Indian Penal Code (IPC) <br> This primary criminal code of India covers various offenses and their corresponding punishments. Here, relevant sections are: * Murder: Defined as the unlawful killing of another human being with malice aforethought. * Culpable homicide: Killing of another person without lawful justification or excuse and without the intention to cause death. * Causing hurt: Intentionally or recklessly causing hurt to another person.",1
"I recently ordered a new phone online, but when it arrived, it was a cheap knock-off! I contacted the seller, but they won't respond to my emails. I paid through a prepaid card, so I can't get my money back that way. What are my options?","The Information Technology Act, 2000 (Sections 66A & 66D) - Criminalizes the sending of offensive messages through a computer or other communication devices.",1
"My neighbor's tree branches are overhanging onto my property, dropping leaves and debris. Can I cut them back?","The Indian Penal Code (IPC), 1860 (Section 426) - Whoever commits mischief shall be punished with imprisonment of either description for a term which may extend to three months, or with fine, or with both.",0
"So, my neighbor just built a giant fence right up against my property line, blocking most of the sunlight from reaching my garden. It's practically casting a shadow over my entire backyard! I can't even enjoy sitting out there anymore. Plus, his dog constantly barks all night, keeping me awake. Is there anything I can do to make him take down the fence and quiet his dog?","The Indian Easements Act, 1882 (Section 13) Where one person transfers or bequeaths immovable property to another, (a)if an easement in other immovable property of the transferor or testator is necessary for enjoying the subject of the transfer or bequest, the transferee or legatee shall be entitled to such easement;",1
"So, my neighbor just built a giant fence right up against my property line, blocking most of the sunlight from reaching my garden. It's practically casting a shadow over my entire backyard! I can't even enjoy sitting out there anymore. Plus, his dog constantly barks all night, keeping me awake. Is there anything I can do to make him take down the fence and quiet his dog?","The Indian Penal Code (IPC), 1860 (Section 268) A person is guilty of a public nuisance who does any act or is guilty of an illegal omission which causes any common injury, danger or annoyance to the public or to the people in general who dwell or occupy property in the vicinity, or which must necessarily cause injury, obstruction, danger or annoyance to persons who may have occasion to use any public right.",1
"So, my neighbor just built a giant fence right up against my property line, blocking most of the sunlight from reaching my garden. It's practically casting a shadow over my entire backyard! I can't even enjoy sitting out there anymore. Plus, his dog constantly barks all night, keeping me awake. Is there anything I can do to make him take down the fence and quiet his dog?","The Indian Penal Code (IPC), 1860 (Section 441): Whoever enters into or upon property in the possession of another with intent to commit an offence or to intimidate, insult or annoy any person in possession of such property, 
or having lawfully entered into or upon such property, unlawfully remains there with intent thereby to intimidate, insult or annoy any such person, or with intent to commit an offence, 
is said to commit “criminal trespass”.",0
"So, my neighbor just built a giant fence right up against my property line, blocking most of the sunlight from reaching my garden. It's practically casting a shadow over my entire backyard! I can't even enjoy sitting out there anymore. Plus, his dog constantly barks all night, keeping me awake. Is there anything I can do to make him take down the fence and quiet his dog?","The Indian Penal Code (IPC), 1860 (Section 426): Whoever commits mischief shall be punished with imprisonment of either description for a term which may extend to three months, or with fine, or with both.",0
"I recently ordered a new phone online, but when it arrived, it was a cheap knock-off! I contacted the seller, but they won't respond to my emails. I paid through a prepaid card, so I can't get my money back that way. What are my options?","The Information Technology Act, 2000 (Sections 66A & 66D): criminalises the sending of offensive messages through a computer or other communication devices..",1
"I recently ordered a new phone online, but when it arrived, it was a cheap knock-off! I contacted the seller, but they won't respond to my emails. I paid through a prepaid card, so I can't get my money back that way. What are my options?","The Consumer Protection Act, 2019, offers consumer rights and redressal mechanisms for getting a refund or replacement.",1
"After winning a lawsuit against a contractor for non-payment of dues, a homeowner seeks to recover the awarded amount through legal means. The homeowner initiates the process of executing the court's decree, following the procedures outlined in the civil procedure code.","Code of Civil Procedure, 1908 - Governs the procedure for civil cases in India, including the execution of decrees.",1
"""In execution of that decree the Munsif issued a warrant for the attachment of the judgment debtor's property.""","Code of Civil Procedure, 1908 - Specifies the process for executing decrees, including the attachment of property.",1
"""The amin to whom the said warrant was entrusted attached, inter alia, three buffaloes and two cows, which were in the house of the judgment debtor, as his property.""","Electricity Act, 2003 - Specifies norms and standards for energy efficiency and conservation in the electricity sector.",0
"In a rural village in India, a young girl named Savitri, aged 14, is being pressured by her family to marry an older man. Savitri is unsure about the marriage and is seeking advice on her rights and the legal implications of marrying at such a young age.",Child Marriage Restraint Act (1929): This act set minimum legal ages for marriage in India. Its crucial since Savitri's age is potentially under consideration within the scenario.,1
A couple from different religious backgrounds decides to marry under a civil law to have a legally recognized marriage without the need for religious ceremonies. They follow the registration procedures outlined in the act to solemnize their marriage legally.,"Special Marriage Act (1954): Provides a framework for civil marriages in India, including registration procedures. This is directly relevant as they appear to be attempting a legally recognized marriage.",1
A couple from different religious backgrounds decides to marry under a civil law to have a legally recognized marriage without the need for religious ceremonies. They follow the registration procedures outlined in the act to solemnize their marriage legally.,The Information Technology Act (2000): Deals with Information Technology related offenses and electronic transactions. ,0
"A group of villagers in a remote area of India is facing frequent power outages and unreliable electricity supply. They are concerned about the quality of service provided by the local electricity distribution company and are seeking advice on how to improve their access to reliable electricity.




A group of villagers in a remote area of India is facing frequent power outages and unreliable electricity supply. They are concerned about the quality of service provided by the local electricity distribution company and are seeking advice on how to improve their access to reliable electricity.




A group of villagers in a remote area of India is facing frequent power outages and unreliable electricity supply. They are concerned about the quality of service provided by the local electricity distribution company and are seeking advice on how to improve their access to reliable electricity.




","Electricity Act, 2003 - Governs the generation, transmission, distribution, and trading of electricity in India.",1
A construction company in India is planning to build a new factory and is interested in setting up its own electricity generation unit. They are seeking guidance on the legal requirements and procedures,"Electricity Act, 2003 - Specifies norms and standards for energy efficiency and conservation in the electricity sector.",1
"In a rural village in India, a young girl named Savitri, aged 14, is being pressured by her family to marry an older man. Savitri is unsure about the marriage and is seeking advice on her rights and the legal implications of marrying at such a young age.","The Narcotic Drugs and Psychotropic Substances Act (1985): Regulates the production, possession, sale, consumption, and import/export of narcotic drugs and psychotropic substances. This law was enacted much later than the scenario (1960) and is not applicable.",0
"A man enters a shop and steals a valuable item, intending to sell it for profit. He is caught on CCTV camera and identified by the shop owner.","Indian Penal Code (1860), Sections related to Theft (e.g., Section 378): This defines the offense of theft in India, which could apply if the meter tampering is done with the intent to dishonestly use the electricity without proper payment.",1
"A businessman approaches a bank for a loan and provides forged documents showing inflated assets to secure a higher loan amount. The bank, unaware of the forgery, approves the loan based on the false information. ","Indian Penal Code (1860): This act defines various criminal offenses, including: * Section 420 (Cheating): Covers acts of deceiving and inducing someone to deliver property or any valuable thing. * Section 465 (Forgery): Defines and penalizes forging of documents and using them as genuine. * Section 467 (Forgery of valuable security): Specifically concerns forging of documents like licenses with intent to use them fraudulently.",1
"In a factory in India, workers are required to work long hours without adequate breaks or safety measures. Several workers have fallen ill due to the unhealthy working conditions, and some have even been injured due to lack of safety equipment. ","Factories Act, 1948: This act regulates the working conditions in factories in India. It covers aspects such as health, safety, welfare, working hours, and leave policies for workers in factories.",1
"A group of individuals is found in possession of unlicensed firearms during a routine police check in a rural area. The firearms are discovered to be used for hunting purposes, but the individuals do not have the required licenses.","Arms Act, 1959: This act regulates the possession, use, and sale of firearms and ammunition in India.",1
"In the 1960s, a group of individuals conspires to commit fraud by forging physical documents related to property ownership. They create fake land deeds and sale agreements to deceive buyers into purchasing property that does not belong to them. The fraud is uncovered, and the individuals are charged under the relevant sections of the Indian Penal Code for forgery and cheating.",Information Technology Act (2000): Focuses on Information Technology related offenses and electronic transactions. The scenario predates this law (1959-1961) and doesn't involve electronic means of forgery or communication.,0
"A married couple belonging to the Hindu religion is facing issues in their marriage. The husband has been verbally and emotionally abusing the wife, causing her mental anguish and distress. Despite attempts at reconciliation, the situation does not improve, and the wife decides to seek legal advice. ","Hindu Marriage Act (1955): This act governs various aspects of marriage, separation, and divorce within Hindu communities. Sections related to cruelty and grounds for divorce or separation could be relevant.",1
"""But some time before the date of the complaint the respondent began to ill treat her, with the result that she had to reside with her mother and brother.""",The Protection of Women from Domestic Violence Act (2005): This act defines various forms of domestic abuse and provides mechanisms for a woman to seek protection. It could be a resource if the ill-treatment falls under the Act's definition.,1
"""But some time before the date of the complaint the respondent began to ill treat her, with the result that she had to reside with her mother and brother.""","Indian Contract Act (1872): Defines and governs various types of contracts and related legal principles. This law wouldn't be directly relevant to the scenario as it focuses on contractual agreements and breaches, whereas the scenario deals with marital issues and potential domestic abuse.",0
"In a region experiencing political unrest, a group of individuals organizes protests against the government, demanding political change. The protests turn violent, with the group resorting to arson and vandalism. ","Sections under the Indian Penal Code (1860) related to Waging War against the Government of India (e.g., Section 121), Sedition (e.g., Section 124A), Unlawful Association (e.g., Section 153A): These sections address acts of violence and incitement aimed at disrupting or overthrowing the established government.",1
"I recently ordered a new phone online, but when it arrived, it was a cheap knock-off! I contacted the seller, but they won't respond to my emails. I paid through a prepaid card, so I can't get my money back that way. What are my options?","The Indian Penal Code (IPC), 1860 (Section 406): Punishment for criminal breach of trust. — Whoever commits criminal breach of trust shall be punished with imprisonment of either description for a term which may extend to three years, or with fine, or with both.",0
My boss has been making inappropriate comments to me for months now. He touches me uninvited and makes suggestive jokes. I feel uncomfortable and unsafe at work. What can I do?,"he Sexual Harassment of Women at Workplace (Prevention, Prohibition and Redressal) Act, 2013, offers protection and a complaint mechanism for workplace sexual harassment.",1
My boss has been making inappropriate comments to me for months now. He touches me uninvited and makes suggestive jokes. I feel uncomfortable and unsafe at work. What can I do?,"The Indian Penal Code (IPC), 1860 (Section 354): This section deals with assault or criminal force to woman with intent to outrage her modesty, but the scenario doesn't explicitly mention any physical assault.",0
My boss has been making inappropriate comments to me for months now. He touches me uninvited and makes suggestive jokes. I feel uncomfortable and unsafe at work. What can I do?,"the Industrial Disputes Act, 1947, makes provision for the investigation and settlement of Industrial Disputes, and for certain other purposes. Where as it is expedient to make provision for the investigation and settlement of industrial disputes.",1
"The brakes on my new scooter malfunctioned, causing me to get into an accident. I broke my arm and will need surgery. The company refuses to accept any responsibility, claiming it's a user error. What should I do?","The Sale of Goods Act, 1930, defines a contract wherein the seller of particular goods transfers or agrees to transfer the goods to the buyer for some price. .",1
"The brakes on my new scooter malfunctioned, causing me to get into an accident. I broke my arm and will need surgery. The company refuses to accept any responsibility, claiming it's a user error. What should I do?","The Consumer Protection Act, 2019, offers consumer rights and redressal mechanisms for getting a refund or replacement.",1
"I recently ordered a new phone online, but when it arrived, it was a cheap knock-off! I contacted the seller, but they won't respond to my emails. I paid through a prepaid card, so I can't get my money back that way. What are my options?","The Motor Vehicles Act, 1956 (Section 181): stipulates the kind of licences needed and the prescribed age requirements to apply for them.",0
"The brakes on my new scooter malfunctioned, causing me to get into an accident. I broke my arm and will need surgery. The company refuses to accept any responsibility, claiming it's a user error. What should I do?","Patents Act, 1970: Although primarily concerned with patents, this act also contains provisions related to the protection of intellectual property rights in general, which may be relevant to copyright protection.",0
"My landlord just increased my rent by a significant amount without any prior notice. It's way above the market rate in the area, and I can't afford it. Is there anything I can do?",The Rent Control Act It regulates the rules of letting out a property and ensures that neither the landlords nor the tenants’ rights are exploited by the other.,1
"My landlord just increased my rent by a significant amount without any prior notice. It's way above the market rate in the area, and I can't afford it. Is there anything I can do?","The Indian Evidence Act, 1872: This act deals with the rules for presenting evidence in court,",0
"My landlord just increased my rent by a significant amount without any prior notice. It's way above the market rate in the area, and I can't afford it. Is there anything I can do?","Indian Contract Act, 1872, When one person signifies to another his willingness to do or to abstain from doing anything, with a view to obtaining the assent of that other to such act or abstinence, he said to make a proposal",1
"I wrote a song and posted it online, but then I saw a popular music artist release a song that sounds very similar to mine! They haven't credited me anywhere. Should I be worried?","The Copyright Act, 1957, protects original literary, dramatic, musical and artistic works and cinematograph films and sound recordings from unauthorized uses.",1
"I wrote a song and posted it online, but then I saw a popular music artist release a song that sounds very similar to mine! They haven't credited me anywhere. Should I be worried?","Right of Children to Free and Compulsory Education Act, 2009 (RTE Act): This act provides for free and compulsory education for all children between the ages of 6 and 14 years. It also lays down specific norms and standards relating to pupil-teacher ratios, infrastructure, and curriculum.",0
"Someone posted a negative review about my business online, claiming I provided poor service. The review is completely false and is damaging my reputation. What can I do?","The IPC, 1860 (Section 500) Whoever defames another shall be punished with simple imprisonment for a term which may extend to two years, or with fine, or with both.",1
The entire scenario involved accusations and investigations but no convictions.,Indian Evidence Act - Deals with the rules for presenting evidence in court. (Applicable throughout the scenario),1
Accused had an illicit relationship with the deceased's wife.,"Electricity Act, 2003 - Specifies norms and standards for energy efficiency and conservation in the electricity sector.",0
Accused was chased away by the deceased.,"Wildlife Protection Act, 1972: While primarily concerned with wildlife conservation, this act also includes provisions for the protection of forests and their habitats. It prohibits hunting of specified animals and regulates trade in wildlife and their products.",0
Accused stole a car for repairs.,"IPC Section 379: Theft. Whoever takes any movable property, belonging to another person with the intention of taking it permanently and dishonestly, is guilty of theft.",1
Accused took deceased and another person for a ride.,"National Council of Educational Research and Training (NCERT) Act, 1961: This act establishes the NCERT as an autonomous organization to assist and advise the central and state governments on policies and programs for qualitative improvement in school education.",0
"A man, in a fit of jealousy, confronts his romantic partner over suspicions of infidelity. During the confrontation, the man loses his temper and strikes his partner with a heavy object, resulting in the partner's death. The man's actions were intentional, and he unlawfully caused the death of another person.",IPC Section 302: Murder. Whoever intentionally and unlawfully causes the death of another person.,1
My boss has been making inappropriate comments to me for months now. He touches me uninvited and makes suggestive jokes. I feel uncomfortable and unsafe at work. What can I do?,"The Code of Criminal Procedure, 1973 (CrPC) Section 100: Power of police officer to recover and take possession of property suspected to be connected with an offence.",0
"A financial advisor, entrusted with managing a client's investment portfolio, instead misappropriates the funds for personal use. The advisor, who was in lawful possession of the client's money, dishonestly converts it to their own use. The client discovers the misappropriation and files a complaint.","Indian Penal Code (IPC) Section 405 (Criminal Breach of Trust): Whoever, being in lawful possession of any property, dishonestly misappropriates or converts to his own use that property, shall be punished with imprisonment of either description for a term which may extend to three years, or with fine, or with both.",1
"A financial advisor, entrusted with managing a client's investment portfolio, instead misappropriates the funds for personal use. The advisor, who was in lawful possession of the client's money, dishonestly converts it to their own use. The client discovers the misappropriation and files a complaint.","Indian Trusts Act, 1882: Defines and regulates the creation and administration of trusts in India.",1
The accused failed to account for the funds when demanded,"Scheduled Tribes and Other Traditional Forest Dwellers (Recognition of Forest Rights) Act, 2006: This act recognizes the rights of forest-dwelling communities, including scheduled tribes, to forest land and other resources. It aims to secure the livelihoods of these communities while conserving forests.",0
The accused violated the rules framed by the West Bengal Board of Secondary Education for managing Provident Funds,"The West Bengal Board of Secondary Education Act, 1963: Establishes the West Bengal Board of Secondary Education and empowers it to frame rules for various purposes, including the management of Provident Funds for affiliated schools.",1
The accused misused the funds for personal benefit,"The Juvenile Justice (Care and Protection of Children) Act, 2015: This act deals with the care, protection, and rehabilitation of children in need of care and protection, as well as children in conflict with the law.",0
"A private school in India, with more than 20 employees, fails to comply with the provisions related to employee Provident Funds, resulting in financial losses for its employees. The relevant authorities take action against the school management for not establishing and maintaining a Provident Fund for its employees, ensuring that the employees receive their Provident Fund benefits as per the law.","Employees' Provident Funds and Miscellaneous Provisions Act, 1952: Regulates the establishment and administration of Provident Funds for employees in various sectors, including educational institutions.",0
The respondents were entrusted with Provident Fund Deposits of teachers.,"Indian Penal Code (IPC), Section 405: Criminal breach of trust- Covers criminal breach of trust, which applies as the respondents were entrusted with the money and allegedly misused it.",1
"A group of trustees is appointed to manage a charitable trust that runs a school for underprivileged children. The trustees are responsible for ensuring that the trust's funds are used for the benefit of the children, including providing education, meals, and healthcare. However, the trustees misappropriate the funds for their personal use, neglecting their duties towards the beneficiaries. ","Indian Trusts Act, 1882: Duties of trustees ",1
"A Muslim couple decides to seek a divorce according to Muslim personal law. The husband pronounces talaq (divorce) to his wife three times in one sitting, intending to end the marriage. The wife accepts the talaq, and the marriage is dissolved as per the provisions of the Muslim Personal Law (Shariat) Application Act, 1937, which governs matters of marriage, divorce, and inheritance among Muslims in India.","The Muslim Personal Law (Shariat) Application Act, 1937, is an Indian law that applies to Muslims in India in matters of marriage, divorce, succession, and other personal affairs. It allows Muslims to be governed by their personal law, based on Islamic principles, in these matters.",1
They failed to account for the money when called upon.,"All India Council for Technical Education (AICTE) Act, 1987: This act establishes the AICTE as a statutory body responsible for the planning and coordination of technical education and for the maintenance of standards.",0
The scenario involves misuse of funds for personal benefit.,"Protection of Plant Varieties and Farmers' Rights Act, 2001: While not directly related to arts, this act protects the rights of farmers and plant breeders and encourages the development of new plant varieties, which can be relevant in the context of traditional arts and crafts.",0
